{
  "schemaVersion": 2,
  "status": "candidate",
  "version": "0.2.0",
  "sourceCommit": "cccccccccccccccccccccccccccccccccccccccc",
  "createdAt": "2026-08-28T02:00:00.000Z",
  "cliVersion": "0.2.0",
  "contracts": {
    "host": 1,
    "module": 1,
    "worker": 1
  },
  "coreMigrationHead": "fixture_0002_runtime",
  "images": {
    "control-plane": {
      "reference": "registry.invalid/vorton-fixture/control-plane@sha256:3333333333333333333333333333333333333333333333333333333333333333",
      "digest": "sha256:3333333333333333333333333333333333333333333333333333333333333333"
    },
    "web": {
      "reference": "registry.invalid/vorton-fixture/web@sha256:4444444444444444444444444444444444444444444444444444444444444444",
      "digest": "sha256:4444444444444444444444444444444444444444444444444444444444444444"
    },
    "worker": {
      "reference": "registry.invalid/vorton-fixture/worker@sha256:5555555555555555555555555555555555555555555555555555555555555555",
      "digest": "sha256:5555555555555555555555555555555555555555555555555555555555555555"
    }
  },
  "managedFiles": [
    {
      "path": "host/vorton-runtime.json",
      "template": "packages/cli/test-fixtures/templates/releases/0.2.0/host/vorton-runtime.json",
      "digest": "sha256:04b122460f12b4c5eeac55fee8b7207455ae4349dbc8c9c0224f1948ab849b89"
    }
  ]
}
