{
  "schemaVersion": 1,
  "status": "candidate",
  "version": "0.1.0",
  "sourceCommit": "aaaaaaaaaaaaaaaaaaaaaaaaaaaaaaaaaaaaaaaa",
  "createdAt": "2026-08-28T00:00:00.000Z",
  "cliVersion": "0.1.0",
  "contracts": {
    "host": 1,
    "module": 1,
    "worker": 1
  },
  "coreMigrationHead": "fixture_0001_kernel",
  "images": {
    "control-plane": {
      "reference": "registry.invalid/vorton-fixture/control-plane@sha256:1111111111111111111111111111111111111111111111111111111111111111",
      "digest": "sha256:1111111111111111111111111111111111111111111111111111111111111111"
    },
    "worker": {
      "reference": "registry.invalid/vorton-fixture/worker@sha256:2222222222222222222222222222222222222222222222222222222222222222",
      "digest": "sha256:2222222222222222222222222222222222222222222222222222222222222222"
    }
  },
  "managedFiles": [
    {
      "path": "host/vorton-runtime.json",
      "template": "packages/cli/test-fixtures/templates/releases/0.1.0/host/vorton-runtime.json",
      "digest": "sha256:d354b5f7c7c1012988d13505b9cde29b18b7cbb088bdef0e9eb1796ea69ba609"
    }
  ]
}
